{
  "schema": "phaseflow.readiness/v1",
  "product_version": "0.10.000",
  "catalog_sha256": "21dac37a13d846cc09a72c39e8fd9bc6eb6d485dceb6e5a885226409d7dc0aad",
  "contracts": [
    {
      "id": "case-index",
      "version": "1.0.0",
      "state": "available",
      "provenance": "real",
      "reason": null,
      "missing": []
    },
    {
      "id": "case-manifest",
      "version": "1.0.0",
      "state": "available",
      "provenance": "real",
      "reason": null,
      "missing": []
    },
    {
      "id": "schedule-trace",
      "version": "1.0.0",
      "state": "available",
      "provenance": "real",
      "reason": null,
      "missing": []
    },
    {
      "id": "learned-model",
      "version": "1.0.0",
      "state": "available",
      "provenance": "real",
      "reason": null,
      "missing": []
    },
    {
      "id": "learned-study",
      "version": "1.0.0",
      "state": "available",
      "provenance": "real",
      "reason": null,
      "missing": []
    }
  ]
}
